TX,48,36450,Randolph Field Independent School District,"1,417",430,41
TX,48,36480,Ranger Independent School District,"3,018",477,136
TX,48,36510,Rankin Independent School District,"1,205",252,27
TX,48,36540,Raymondville Independent School District,"13,279","2,017",877
TX,48,36570,Reagan County Independent School District,"3,710",785,145
TX,48,36630,Red Lick Independent School District,"2,498",492,86
TX,48,36660,Red Oak Independent School District,"29,567","6,123",564
TX,48,36750,Redwater Independent School District,"5,120","1,026",104
TX,48,36780,Refugio Independent School District,"3,848",673,157
TX,48,36930,Ricardo Independent School District,"3,732",818,227
TX,48,36970,Rice Consolidated Independent School District,"6,959","1,294",330
TX,48,36960,Rice Independent School District,"2,996",686,162
TX,48,36990,Richards Independent School District,"1,732",261,52
TX,48,37020,Richardson Independent School District,"238,647","40,051","7,300"
TX,48,37080,Richland Springs Independent School District,917,155,21
TX,48,37110,Riesel Independent School District,"2,408",472,62
TX,48,37140,Rio Grande City Consolidated Independent School District,"38,454","8,976","3,132"
TX,48,37170,Rio Hondo Independent School District,"10,253","2,324",715
TX,48,37200,Rio Vista Independent School District,"4,451",853,242
TX,48,37230,Rising Star Independent School District,"1,389",222,55
TX,48,37260,River Road Independent School District,"6,989","1,340",219
TX,48,42120,Rivercrest Independent School District,"3,673",586,148
TX,48,37320,Riviera Independent School District,"1,534",261,41
TX,48,37380,Robert Lee Independent School District,"1,623",222,50
TX,48,37410,Robinson Independent School District,"11,211","2,213",250
TX,48,37440,Robstown Independent School District,"16,394","3,347","1,117"
TX,48,37470,Roby Consolidated Independent School District,"1,395",226,46
TX,48,37500,Rochelle Independent School District,859,129,29
TX,48,37590,Rockdale Independent School District,"9,153","1,751",447
TX,48,3,Rocksprings Independent School District,"1,592",272,103
TX,48,37650,Rockwall Independent School District,"78,245","16,312",986
TX,48,37710,Rogers Independent School District,"4,365",854,97
TX,48,37740,Roma Independent School District,"24,915","5,739","2,571"
TX,48,37800,Roosevelt Independent School District,"6,106","1,234",301
TX,48,37830,Ropes Independent School District,"1,247",259,50
TX,48,37860,Roscoe Collegiate Independent School District,"1,809",332,87
TX,48,37900,Rosebud-Lott Independent School District,"4,832",825,204
TX,48,38040,Rotan Independent School District,"1,905",284,60
TX,48,38080,Round Rock Independent School District,"296,202","55,904","3,323"
TX,48,38100,Round Top-Carmine Independent School District,"1,872",211,25
TX,48,38160,Roxton Independent School District,"1,235",205,40
TX,48,38190,Royal Independent School District,"12,292","2,539",623
TX,48,38220,Royse City Independent School District,"24,332","5,182",381
TX,48,38280,Rule Independent School District,875,128,45
TX,48,38310,Runge Independent School District,"1,358",284,63
TX,48,38360,Rusk Independent School District,"12,541","2,068",387
TX,48,38400,S and S Consolidated Independent School District,"5,481","1,017",158
TX,48,38430,Sabinal Independent School District,"2,720",505,115
TX,48,38460,Sabine Independent School District,"6,716","1,315",178
TX,48,38490,Sabine Pass Independent School District,402,44,8
TX,48,38580,Salado Independent School District,"8,159","1,447",147
TX,48,38610,Saltillo Independent School District,"1,242",248,48
TX,48,38640,Sam Rayburn Independent School District,"2,513",429,65
TX,48,38700,San Angelo Independent School District,"101,116","16,547","3,330"
TX,48,38730,San Antonio Independent School District,"351,955","61,873","20,356"
TX,48,38760,San Augustine Independent School District,"5,220",775,237
TX,48,38790,San Benito Consolidated Independent School District,"44,685","10,671","4,348"
TX,48,38820,San Diego Independent School District,"6,706","1,206",534
TX,48,38850,San Elizario Independent School District,"14,547","3,571","1,409"
TX,48,38900,San Felipe-Del Rio Consolidated Independent School District,"48,594","9,662","2,918"
TX,48,38910,San Isidro Independent School District,"1,085",196,68
TX,48,38970,San Marcos Consolidated Independent School District,"85,390","9,916","1,949"
TX,48,39000,San Perlita Independent School District,935,171,71
TX,48,39030,San Saba Independent School District,"4,406",618,174
TX,48,39060,San Vicente Independent School District,219,25,3
TX,48,39120,Sands Consolidated Independent School District,728,166,31
TX,48,39150,Sanford-Fritch Independent School District,"4,932",847,69
TX,48,39180,Sanger Independent School District,"16,305","3,109",275
TX,48,39210,Santa Anna Independent School District,"1,653",297,127
TX,48,39270,Santa Fe Independent School District,"27,832","5,117",482
TX,48,39300,Santa Gertrudis Independent School District,29,3,1
TX,48,39330,Santa Maria Independent School District,"2,652",681,254
TX,48,39360,Santa Rosa Independent School District,"5,450","1,239",434
TX,48,39390,Santo Independent School District,"3,258",521,156
TX,48,39450,Savoy Independent School District,"1,893",312,31
TX,48,39480,Schertz-Cibolo-Universal City Independent School District,"70,413","14,332","1,076"
TX,48,39510,Schleicher Independent School District,"3,001",631,135
TX,48,39540,Schulenburg Independent School District,"5,317",814,150
TX,48,39570,Scurry-Rosser Independent School District,"5,004",983,162
TX,48,39600,Seagraves Independent School District,"3,259",756,259
TX,48,39630,Sealy Independent School District,"13,719","2,590",384
TX,48,39690,Seguin Independent School District,"52,176","8,608","1,658"
TX,48,39750,Seminole Independent School District,"16,956","4,459",874
TX,48,39780,Seymour Independent School District,"3,654",589,153
TX,48,39870,Shallowater Independent School District,"5,965","1,422",190
TX,48,39900,Shamrock Independent School District,"2,431",414,109
TX,48,39930,Sharyland Independent School District,"44,367","10,817","2,463"
TX,48,39960,Shelbyville Independent School District,"3,543",632,191
TX,48,39990,Sheldon Independent School District,"34,783","8,211","1,753"
TX,48,40020,Shepherd Independent School District,"9,838","1,839",469
TX,48,40080,Sherman Independent School District,"44,870","7,626","1,741"
TX,48,40110,Shiner Independent School District,"4,077",772,81
TX,48,40170,Sidney Independent School District,578,95,19
TX,48,40200,Sierra Blanca Independent School District,777,114,24
TX,48,40230,Silsbee Independent School District,"17,666","3,134",709
TX,48,40290,Silverton Independent School District,"1,026",150,29
TX,48,40320,Simms Independent School District,"5,778",589,130
TX,48,40350,Sinton Independent School District,"9,702","1,909",484
TX,48,40380,Sivells Bend Independent School District,553,62,7
TX,48,40410,Skidmore-Tynan Independent School District,"2,948",586,115
TX,48,40440,Slaton Independent School District,"8,386","1,672",530
TX,48,40470,Slidell Independent School District,"2,205",363,44
TX,48,40500,Slocum Independent School District,"2,059",328,70
TX,48,40550,Smithville Independent School District,"12,258","2,026",324
TX,48,40590,Smyer Independent School District,"1,675",323,80
TX,48,40620,Snook Independent School District,"3,129",528,100
TX,48,40650,Snyder Independent School District,"15,744","2,892",700
TX,48,40710,Socorro Independent School District,"189,055","42,800","10,050"
TX,48,40740,Somerset Independent School District,"16,941","3,785","1,178"
TX,48,40770,Somerville Independent School District,"4,200",539,176
TX,48,40800,Sonora Independent School District,"3,767",666,154
TX,48,40680,South San Antonio Independent School District,"51,061","10,928","3,027"
TX,48,40890,Southland Independent School District,290,42,9
TX,48,40920,Southside Independent School District,"26,549","5,902","1,628"
TX,48,40950,Southwest Independent School District,"59,141","13,426","3,484"
TX,48,41010,Spearman Independent School District,"3,679",787,147
TX,48,41070,Splendora Independent School District,"17,993","3,758",530
TX,48,41100,Spring Branch Independent School District,"196,222","37,378","7,516"
TX,48,41130,Spring Creek Independent School District,154,32,3
TX,48,41190,Spring Hill Independent School District,"8,710","2,080",321
TX,48,41220,Spring Independent School District,"189,867","39,804","9,363"
TX,48,41250,Springlake-Earth Independent School District,"1,626",352,54
TX,48,41280,Springtown Independent School District,"21,099","3,930",535
TX,48,2,Spur Independent School District,"1,883",262,59
TX,48,41340,Spurger Independent School District,"2,161",366,96
TX,48,38520,St. Jo Independent School District,"1,734",297,29
TX,48,41350,Stafford Municipal School District,"22,414","3,639",438
TX,48,41400,Stamford Independent School District,"3,397",549,148
TX,48,41430,Stanton Independent School District,"4,456",961,172
TX,48,41520,Stephenville Independent School District,"28,071","3,623",528
TX,48,41550,Sterling City Independent School District,"1,295",269,45
TX,48,41610,Stockdale Independent School District,"4,968",848,220
TX,48,41670,Stratford Independent School District,"2,530",531,86
TX,48,41700,Strawn Independent School District,804,152,30
TX,48,41760,Sudan Independent School District,"1,433",337,78
TX,48,41790,Sulphur Bluff Independent School District,"1,208",203,29
TX,48,41820,Sulphur Springs Independent School District,"23,966","4,295",898
TX,48,41850,Sundown Independent School District,"1,607",398,55
TX,48,41880,Sunnyvale Independent School District,"5,718","1,168",78
TX,48,41910,Sunray Independent School District,"2,135",477,51
TX,48,41970,Sweeny Independent School District,"11,659","2,243",367
TX,48,42000,Sweet Home Independent School District,815,144,10
TX,48,42030,Sweetwater Independent School District,"12,332","2,312",628
TX,48,42060,Taft Independent School District,"5,311","1,113",316
TX,48,42090,Tahoka Independent School District,"3,013",582,156
TX,48,42210,Tarkington Independent School District,"9,577","2,025",475
TX,48,42240,Tatum Independent School District,"5,824","1,081",238
TX,48,42280,Taylor Independent School District,"21,250","3,855",561
TX,48,42300,Teague Independent School District,"5,834","1,127",297
TX,48,42330,Temple Independent School District,"61,918","10,511","2,981"
TX,48,42360,Tenaha Independent School District,"2,336",461,150
TX,48,42390,Terlingua Common School District,792,127,36
TX,48,42420,Terrell County Independent School District,810,133,28
TX,48,42450,Terrell Independent School District,"29,498","5,116",982
TX,48,42480,Texarkana Independent School District,"32,133","5,619","1,755"
TX,48,42510,Texas City Independent School District,"63,425","11,180","2,711"
TX,48,42540,Texhoma Independent School District,548,121,9
TX,48,42570,Texline Independent School District,"1,031",245,27
TX,48,42630,Thorndale Independent School District,"3,044",558,96
TX,48,42660,Thrall Independent School District,"4,095",759,62
TX,48,42690,Three Rivers Independent School District,"4,505",620,139
TX,48,42720,Three Way Independent School District,608,99,11
TX,48,42780,Throckmorton Independent School District,"1,084",171,42
TX,48,42810,Tidehaven Independent School District,"4,085",773,172
TX,48,42840,Timpson Independent School District,"3,940",747,269
TX,48,42870,Tioga Independent School District,"1,408",256,38
TX,48,42900,Tolar Independent School District,"2,973",599,86
TX,48,42930,Tom Bean Independent School District,"4,579",895,106
TX,48,42960,Tomball Independent School District,"63,711","12,312","1,002"
TX,48,42990,Tornillo Independent School District,"3,904","1,099",415
TX,48,43110,Trent Independent School District,751,121,20
TX,48,43140,Trenton Independent School District,"3,189",646,90
TX,48,43170,Trinidad Independent School District,919,148,42
TX,48,43200,Trinity Independent School District,"8,113","1,205",385
TX,48,43230,Troup Independent School District,"5,329","1,016",203
TX,48,43260,Troy Independent School District,"6,682","1,351",178
TX,48,43320,Tulia Independent School District,"5,561","1,060",313
TX,48,43350,Tuloso-Midway Independent School District,"13,259","2,780",556
TX,48,43400,Turkey-Quitaque Independent School District,983,160,60
TX,48,43470,Tyler Independent School District,"128,318","22,035","4,389"
TX,48,43530,Union Grove Independent School District,"3,012",610,97
TX,48,43560,Union Hill Independent School District,"2,041",321,68
TX,48,43650,United Independent School District,"172,046","42,686","12,402"
TX,48,43680,Utopia Independent School District,"1,469",163,40
TX,48,43720,Uvalde Consolidated Independent School District,"23,584","4,767","1,611"
TX,48,43740,Valentine Independent School District,311,15,3
TX,48,43760,Valley Mills Independent School District,"3,451",614,114
TX,48,43800,Valley View Independent School District,"16,151","4,531","1,637"
TX,48,43860,Valley View Independent School District,"3,268",525,87
TX,48,43890,Van Alstyne Independent School District,"7,723","1,562",166
TX,48,43920,Van Independent School District,"14,339","2,525",406
TX,48,43950,Van Vleck Independent School District,"4,962",819,139
TX,48,43980,Vega Independent School District,"1,183",188,24
TX,48,44010,Venus Independent School District,"10,602","2,048",315
TX,48,44040,Veribest Independent School District,"1,228",250,42
TX,48,44110,Vernon Independent School District,"12,216","2,048",430
TX,48,44150,Victoria Independent School District,"83,856","15,450","3,272"
TX,48,44160,Vidor Independent School District,"26,444","4,773",868
TX,48,44250,Vysehrad Independent School District,788,114,8
TX,48,44280,Waco Independent School District,"109,920","17,376","5,159"
TX,48,44310,Waelder Independent School District,"2,139",356,96
TX,48,44370,Walcott Independent School District,139,30,5
TX,48,44410,Wall Independent School District,"4,481","1,001",107
TX,48,44430,Waller Independent School District,"37,618","6,639","1,107"
TX,48,44490,Walnut Bend Independent School District,168,37,6
TX,48,44520,Walnut Springs Independent School District,"1,306",209,83
TX,48,44580,Warren Independent School District,"6,168",971,167
TX,48,44670,Waskom Independent School District,"4,420",813,130
TX,48,44710,Water Valley Independent School District,"1,986",330,58
TX,48,44730,Waxahachie Independent School District,"47,519","8,606","1,015"
TX,48,44800,Weatherford Independent School District,"54,201","9,253","1,118"
TX,48,44810,Webb Consolidated Independent School District,"1,452",318,142
TX,48,44820,Weimar Independent School District,"4,582",691,113
TX,48,44890,Wellington Independent School District,"2,939",609,151
TX,48,44910,Wellman-Union Consolidated Independent School District,638,126,37
TX,48,44940,Wells Independent School District,"1,913",379,105
TX,48,44960,Weslaco Independent School District,"75,318","17,272","6,609"
TX,48,45000,West Hardin County Consolidated Independent School District,"3,810",636,39
TX,48,45040,West Independent School District,"8,545","1,600",195
TX,48,45090,West Orange-Cove Consolidated Independent School District,"18,202","2,775",927
TX,48,45120,West Oso Independent School District,"9,777","1,972",533
TX,48,45150,West Rusk County Consolidated Independent School District,"5,638","1,089",221
TX,48,45180,West Sabine Independent School District,"2,619",514,132
TX,48,45210,Westbrook Independent School District,811,138,45
TX,48,45240,Westhoff Independent School District,478,60,20
TX,48,45330,Westphalia Independent School District,370,49,6
TX,48,43290,Westwood Independent School District,"14,767","1,741",257
TX,48,45380,Wharton Independent School District,"13,222","2,325",513
TX,48,45420,Wheeler Independent School District,"2,082",420,95
TX,48,45450,White Deer Independent School District,"1,611",271,15
TX,48,45480,White Oak Independent School District,"6,691","1,483",302
TX,48,45540,White Settlement Independent School District,"35,690","6,833",950
TX,48,45570,Whiteface Consolidated Independent School District,857,165,52
TX,48,45600,Whitehouse Independent School District,"27,121","5,505",773
TX,48,45630,Whitesboro Independent School District,"10,200","1,585",332
TX,48,45670,Whitewright Independent School District,"3,972",786,145
TX,48,45690,Whitharral Independent School District,476,98,18
TX,48,45720,Whitney Independent School District,"9,953","1,557",287
TX,48,45780,Wichita Falls Independent School District,"88,197","14,601","3,125"
TX,48,45840,Wildorado Independent School District,358,60,15
TX,48,45900,Willis Independent School District,"45,362","8,198","1,192"
TX,48,45950,Wills Point Independent School District,"14,782","2,610",526
TX,48,45990,Wilson Independent School District,881,168,62
TX,48,9,Wimberley Independent School District,"18,051","2,585",185
TX,48,46080,Windthorst Independent School District,"1,487",313,26
TX,48,46110,Winfield Independent School District,"1,019",174,59
TX,48,46170,Wink-Loving Independent School District,"1,201",263,56
TX,48,46200,Winnsboro Independent School District,"9,254","1,457",276
TX,48,46230,Winona Independent School District,"6,128","1,020",307
TX,48,46260,Winters Independent School District,"3,385",596,160
TX,48,46320,Woden Independent School District,"3,128",693,174
TX,48,46350,Wolfe City Independent School District,"3,325",581,102
TX,48,46380,Woodsboro Independent School District,"2,698",457,102
TX,48,46410,Woodson Independent School District,475,68,16
TX,48,46440,Woodville Independent School District,"11,065","1,304",403
TX,48,46470,Wortham Independent School District,"2,119",391,83
TX,48,46500,Wylie Independent School District,"18,381","3,770",294
TX,48,46530,Wylie Independent School District,"70,378","15,533",827
TX,48,46590,Yantis Independent School District,"3,574",390,100
TX,48,46620,Yoakum Independent School District,"8,902","1,765",411
TX,48,46650,Yorktown Independent School District,"3,541",552,142
TX,48,46680,Ysleta Independent School District,"202,433","37,342","12,478"
TX,48,46710,Zapata County Independent School District,"14,322","3,418","1,476"
TX,48,46740,Zavalla Independent School District,"3,008",489,120
TX,48,46770,Zephyr Independent School District,813,138,23
